{
  "$schema": "./schema/deployment.schema.json",
  "schemaVersion": 1,
  "network": "Robinhood Chain",
  "chainId": 4663,
  "deploymentBlock": 25393023,
  "immutable": true,
  "broadcast": {
    "date": "2026-08-01",
    "blocks": [
      25393021,
      25393023
    ],
    "operator": "0x1f23c28F93aE48E6346DD05Ca66ba5e2213b00b8",
    "operatorNonce": 0,
    "gasUsed": 14816427,
    "artifact": "packages/contracts/broadcast/Deploy.s.sol/4663/run-1785622792525.json"
  },
  "build": {
    "compiler": "solc 0.8.26",
    "optimizer": true,
    "optimizerRuns": 1000000,
    "evmVersion": "cancun",
    "settings": "packages/contracts/foundry.toml",
    "dependencies": "pinned by scripts/vendor-contracts-deps.sh to the commits matching the bytecode already on 4663"
  },
  "contracts": {
    "factoryOrigin": {
      "address": "0x52490ee359bcF5fE60D79fA4D5eA8bFED853f592",
      "runtimeCodeHash": "0x365786394356e8ea4d207d78725c75b4854dc164b652b6a990f78e10e77c37dc",
      "runtimeCodeSize": 1070,
      "transactionHash": "0xd1e989a65da1ec7d616ff68bfe9f2b8c85e26d0f8476626c51f32f2e915027a2",
      "explorer": "https://robinhoodchain.blockscout.com/address/0x52490ee359bcF5fE60D79fA4D5eA8bFED853f592"
    },
    "modelRegistry": {
      "address": "0xfC54c8fb2F5B9da90ca8227866b48a429568EA03",
      "runtimeCodeHash": "0x8ebbbb54957cefab299927aedcb5f64d842f4cf20e969e4c9a6a2a20b017c0dd",
      "runtimeCodeSize": 5675,
      "transactionHash": "0xdab57d72a6188bfc41312f04874897b7a59409ee4ebe54ded1494698d854aaf0",
      "explorer": "https://robinhoodchain.blockscout.com/address/0xfC54c8fb2F5B9da90ca8227866b48a429568EA03"
    },
    "marketRegistry": {
      "address": "0x03f002FD5A8070D73f4f1627586968D446512A27",
      "runtimeCodeHash": "0x9ecf71cc7084ca3ae375b7566d302820c660289b0a00f85ed4d1857fe48af026",
      "runtimeCodeSize": 5129,
      "transactionHash": "0xd7282fe98c4b9fed6d7c16826bc79a1c30311c1289264999a813a8f415a3a0c0",
      "explorer": "https://robinhoodchain.blockscout.com/address/0x03f002FD5A8070D73f4f1627586968D446512A27"
    },
    "verdantDeployer": {
      "address": "0x0B94311A18d2F3E0f38b670cF0a4927ed65420F3",
      "runtimeCodeHash": "0xa800dd2b4ad101b3b1841cd06a42a18ddc4b6aed1b4a83d018c9485f18e701b5",
      "runtimeCodeSize": 21318,
      "transactionHash": "0xc5d7cc8a9aa3ab627d2b2621fe410cd75a195772f1d9ed9e9e7493d9eb39aa4b",
      "explorer": "https://robinhoodchain.blockscout.com/address/0x0B94311A18d2F3E0f38b670cF0a4927ed65420F3"
    },
    "hook": {
      "address": "0xf998c32CDdFA6354bd80Aab470C6ECF4d83Bb880",
      "runtimeCodeHash": "0x636bf6668dbf46f0c8c60e30ff2135909a2772c3efe3808e8faeaa946a57730d",
      "runtimeCodeSize": 8784,
      "transactionHash": "0xba983d0c72bfe55e8254501ae3c1d5548ed7fb5db5daccc3f2533f1dc1064044",
      "explorer": "https://robinhoodchain.blockscout.com/address/0xf998c32CDdFA6354bd80Aab470C6ECF4d83Bb880"
    },
    "factory": {
      "address": "0x661A5B2A8d7DC0EaEd98B335e070478b40B92Dd9",
      "runtimeCodeHash": "0x17cf9763aae77933c9550f6fea7b7c67ba86673a12c8b3dd5a3e6c10363e29eb",
      "runtimeCodeSize": 16848,
      "transactionHash": "0x975a498732790cda6ffe5d1900c42ad6f18d5493350e393167dfe27370692110",
      "explorer": "https://robinhoodchain.blockscout.com/address/0x661A5B2A8d7DC0EaEd98B335e070478b40B92Dd9"
    }
  },
  "addons": {
    "agenFactoryOrigin": {
      "address": "0xC0297B2d987793dE96f568C169b1ff90C226BE27",
      "runtimeCodeHash": "0x84673e304bce87dea1cce9b7f5c11dec9221af62585048f8b4ec0a98de9c2744",
      "runtimeCodeSize": 1070,
      "transactionHash": "0x93d2ccb2ad63103ffabbee922f3f78d5c1945d7890770d2d99a5182b4608313a",
      "explorer": "https://robinhoodchain.blockscout.com/address/0xC0297B2d987793dE96f568C169b1ff90C226BE27",
      "enabled": true,
      "note": "The anchor Agen's factory address was read from rather than predicted. Its single creation is spent; it does nothing else and nothing calls it again."
    },
    "agenDeployer": {
      "address": "0x4C812526bF606927a887111299f94e35AE5bd77E",
      "runtimeCodeHash": "0x3f94935b9559420efcd6b015745865c021957446bb91190d40e1626397c04494",
      "runtimeCodeSize": 1209,
      "transactionHash": "0xd9e042905f339e11c7329e1a7dbcc6f642845db5c33c97658c538065ad910c2c",
      "explorer": "https://robinhoodchain.blockscout.com/address/0x4C812526bF606927a887111299f94e35AE5bd77E",
      "enabled": true,
      "note": "Performs every generated market's CREATE2. Refuses every caller but AgenFactory."
    },
    "agenMarketRegistry": {
      "address": "0x3AE1a797750ed9988ea7C2348534519E44Ed0791",
      "runtimeCodeHash": "0x6cc05cca6f92b8a3a0ffb0c700b75e5af576b49e7911e3e1cf68d460cf58a0a8",
      "runtimeCodeSize": 5918,
      "transactionHash": "0xfd7a6dd5c9357c441f5de028f76838b90ec6594f34751f98fa950b337dc21de2",
      "explorer": "https://robinhoodchain.blockscout.com/address/0x3AE1a797750ed9988ea7C2348534519E44Ed0791",
      "enabled": true,
      "note": "Append-only, ownerless record of every generated market. Writable by AgenFactory alone."
    },
    "agenFactory": {
      "address": "0xb0fD1387ae751A377dEC0DF46b643B634eE46acc",
      "runtimeCodeHash": "0xf01078d09ef6609f489748b99b6d832a612782d737f5c22d1b7e5d7985615e45",
      "runtimeCodeSize": 19026,
      "transactionHash": "0x11e5efacec5cbea938dc5de0ee1d922b33cc326fd9e42a65bd6207876f9edaea",
      "explorer": "https://robinhoodchain.blockscout.com/address/0xb0fD1387ae751A377dEC0DF46b643B634eE46acc",
      "enabled": true,
      "note": "Agen's launch layer, broadcast 2026-08-12 in blocks 34794809-34794810 from operator 0x1f23c28F93aE48E6346DD05Ca66ba5e2213b00b8 for 6,143,317 gas. An addon rather than part of the deployment above because the two share a PoolManager and nothing else: Agen names nothing in Verdant's set and nothing in it names Agen. VerifyAgen.s.sol passed against these with no warnings before they were recorded. The transaction hash is a call to the anchor, which is what created the factory."
    },
    "feeForwarderFactory": {
      "address": "0x266DEbCE6d33a4b84C140541bC142c7C8b46ae63",
      "runtimeCodeHash": "0x09b98c5bde60b3e942e4d7a4d4b570ea25bc9a32c49bcee04841542603e2bb9b",
      "runtimeCodeSize": 3713,
      "transactionHash": "0x6dffa4e9bdc1ae22d1b6021afa78940461c911616fd50d4327dcbfa4cc603d9f",
      "explorer": "https://robinhoodchain.blockscout.com/address/0x266DEbCE6d33a4b84C140541bC142c7C8b46ae63",
      "enabled": false
    },
    "agenEngineFactoryOrigin": {
      "address": "0x79Fcd7E5aF04BD28AdD9AF681Fd833D8e0273cF6",
      "runtimeCodeHash": "0x36029e0e802a3a07d18fcafd8d2e6642c5c0ee05597714ce1b4308f520113d7a",
      "runtimeCodeSize": 1070,
      "transactionHash": "0xa60146c07ae30c00f63c3c799a8cb2868eb29ee32c18107a8b542154b6e58317",
      "explorer": "https://robinhoodchain.blockscout.com/address/0x79Fcd7E5aF04BD28AdD9AF681Fd833D8e0273cF6",
      "enabled": true,
      "note": "The engine's own anchor, and the reason its factory's address could be known before the factory's code existed: it publishes the address of its first and only creation, which the hook's initcode then embeds. Its one creation is spent. A second engine means a second anchor, never this one again."
    },
    "agenEngineDeployer": {
      "address": "0x633525243d3C2b0419dB462C9eD13B3f52f49147",
      "runtimeCodeHash": "0x9ad72cf608d19209dbefb4c00822f6149c7f849afe0e64c90b9751b53f32127c",
      "runtimeCodeSize": 21810,
      "transactionHash": "0xa32e2cdca5f48976a3611bce37fdc2bf444bed81ad6c88d3e43036dea06373c8",
      "explorer": "https://robinhoodchain.blockscout.com/address/0x633525243d3C2b0419dB462C9eD13B3f52f49147",
      "enabled": true,
      "note": "Holds the token, vault and locker creation code for every engine market, and refuses every caller but AgenEngineFactory. It exists so the factory stays under EIP-170; at 21,810 bytes it has the least margin of anything in the repository."
    },
    "agenEngineRegistry": {
      "address": "0x71a284dd8Efe6aBFd240B96E861486638B0099eE",
      "runtimeCodeHash": "0xcb67d59c2ce2cf9fa3eab364e78a14ed6ab691fa553fa06195c679b0afe500ba",
      "runtimeCodeSize": 5918,
      "transactionHash": "0x1ca18816e904277da47503b972e2841105f745c845fb4f9f55f79eed8b16968e",
      "explorer": "https://robinhoodchain.blockscout.com/address/0x71a284dd8Efe6aBFd240B96E861486638B0099eE",
      "enabled": true,
      "note": "A second AgenMarketRegistry instance, not a second use of the engine-0 one at 0x3AE1a797. That registry's writer is an immutable naming AgenFactory and could not accept writes from here. The separation is also what guarantees no engine-0 market is reinterpreted: nothing in this deployment reads or writes the older table."
    },
    "agenEngineHook": {
      "address": "0x41BC055e9abc03fAd3A8f65da05B93F449f3F8Cc",
      "runtimeCodeHash": "0x77fbe101096096af54ce3ea0e615ab1d669632b4675d132c60b9b2d64886ee28",
      "runtimeCodeSize": 18007,
      "transactionHash": "0x789f6f8c82b78290f232a7889b7743ee613f7304703959892d8b41e7b1ddc712",
      "explorer": "https://robinhoodchain.blockscout.com/address/0x41BC055e9abc03fAd3A8f65da05B93F449f3F8Cc",
      "enabled": true,
      "note": "One hook shared by every engine market, mined under salt 0x4382 so its low 14 bits are 0x38cc: the four VerdantHook has, plus afterSwap and both returns-delta bits. The delta bits are what let it charge a fee at all — without them the PoolManager never reads what the hook returns, every swap balances, and every market charges nothing while appearing to work. Because it is shared, it is never a market identifier; a market is identified by its pool id and by the factory that deployed it."
    },
    "agenEngineFactory": {
      "address": "0x20D5F0867C7dcFfa86f6C411aab4752E1A04b22d",
      "runtimeCodeHash": "0x18ebda0132f2c12d937a318be43bc33e24bf2e8a5638da07c732fbae31ca20fe",
      "runtimeCodeSize": 14651,
      "transactionHash": "0xe71151350e2b3b797438d689f7eed8a0535d2b7e24f5d3b90714e994265e1c20",